{
  "$schema": "http://json-schema.org/draft-07/schema#",
  "$id": "https://raw.githubusercontent.com/Gens-ai/autopilot/main/autopilot.schema.json",
  "title": "Autopilot Configuration",
  "description": "Configuration file for Autopilot - autonomous TDD development with Claude Code",
  "type": "object",
  "required": [
    "version",
    "project",
    "feedbackLoops",
    "iterations"
  ],
  "properties": {
    "$schema": {
      "type": "string",
      "description": "JSON Schema reference"
    },
    "version": {
      "type": "string",
      "description": "Configuration schema version",
      "pattern": "^\\d+\\.\\d+\\.\\d+$"
    },
    "model": {
      "type": [
        "string",
        "null"
      ],
      "default": null,
      "description": "Default Claude model for run.sh-spawned sessions (e.g. 'sonnet', 'opus', 'haiku', or a full model name). The --model CLI flag overrides this; null or absent uses the user's Claude Code default model. Well-specified TDD requirements usually don't need the priciest tier."
    },
    "project": {
      "type": "object",
      "description": "Project type and conventions",
      "required": [
        "type",
        "conventions"
      ],
      "properties": {
        "type": {
          "type": [
            "string",
            "null"
          ],
          "description": "Project type/language",
          "enum": [
            "nodejs",
            "python",
            "go",
            "rust",
            "ruby",
            "java",
            "typescript",
            "php",
            "dotnet",
            "other",
            null
          ]
        },
        "conventions": {
          "type": "object",
          "properties": {
            "testFilePattern": {
              "type": [
                "string",
                "null"
              ],
              "description": "Glob pattern for test files (e.g., '*.test.ts', '*_test.py')"
            },
            "testDirectory": {
              "type": [
                "string",
                "null"
              ],
              "description": "Directory containing tests (e.g., 'tests/', '__tests__/')"
            },
            "sourceDirectory": {
              "type": [
                "string",
                "null"
              ],
              "description": "Main source directory (e.g., 'src/', 'lib/')"
            }
          }
        }
      }
    },
    "feedbackLoops": {
      "type": "object",
      "description": "Commands to run before committing",
      "properties": {
        "typecheck": {
          "type": "object",
          "properties": {
            "command": {
              "type": [
                "string",
                "null"
              ],
              "description": "Command to run type checking (e.g., 'npm run typecheck', 'tsc --noEmit', 'mypy .')"
            },
            "enabled": {
              "type": "boolean",
              "default": true,
              "description": "Whether to run this feedback loop"
            },
            "sandbox": {
              "type": "boolean",
              "default": true,
              "description": "Run in sandbox mode. Set to false if command needs network access like database connections or Docker port forwarding"
            }
          }
        },
        "tests": {
          "type": "object",
          "properties": {
            "command": {
              "type": [
                "string",
                "null"
              ],
              "description": "Default command to run tests (e.g., 'npm test', 'pytest', 'go test ./...')"
            },
            "enabled": {
              "type": "boolean",
              "default": true,
              "description": "Whether to run this feedback loop"
            },
            "sandbox": {
              "type": "boolean",
              "default": true,
              "description": "Run in sandbox mode. Set to false if tests need network access like database connections or Docker port forwarding"
            },
            "commands": {
              "type": "object",
              "description": "Test commands per test type. If a requirement specifies testType, use the corresponding command.",
              "properties": {
                "unit": {
                  "type": [
                    "string",
                    "null"
                  ],
                  "description": "Command for unit tests (e.g., 'npm test -- --testPathPattern=unit')"
                },
                "integration": {
                  "type": [
                    "string",
                    "null"
                  ],
                  "description": "Command for integration tests (e.g., 'npm test -- --testPathPattern=integration')"
                },
                "e2e": {
                  "type": [
                    "string",
                    "null"
                  ],
                  "description": "Command for end-to-end tests (e.g., 'npm run test:e2e', 'playwright test')"
                }
              }
            }
          }
        },
        "lint": {
          "type": "object",
          "properties": {
            "command": {
              "type": [
                "string",
                "null"
              ],
              "description": "Command to run linting (e.g., 'npm run lint', 'eslint .', 'ruff check .')"
            },
            "enabled": {
              "type": "boolean",
              "default": true,
              "description": "Whether to run this feedback loop"
            },
            "sandbox": {
              "type": "boolean",
              "default": true,
              "description": "Run in sandbox mode. Set to false if linting needs network access"
            }
          }
        }
      }
    },
    "iterations": {
      "type": "object",
      "description": "Maximum iterations per mode. Lower defaults for token frugality - restart sessions frequently for fresh context.",
      "properties": {
        "tasks": {
          "type": "integer",
          "default": 15,
          "minimum": 1,
          "maximum": 200,
          "description": "Max iterations for TDD task completion. Each requirement needs ~3-5 iterations for full TDD cycle. Default 15 handles ~3-5 requirements per session. Increase for larger task files."
        },
        "tests": {
          "type": "integer",
          "default": 10,
          "minimum": 1,
          "maximum": 200,
          "description": "Max iterations for test coverage mode. Each uncovered path needs ~2-3 iterations. Default 10 handles ~3-5 test additions per session."
        },
        "lint": {
          "type": "integer",
          "default": 15,
          "minimum": 1,
          "maximum": 200,
          "description": "Max iterations for linting mode. Each lint error fix needs ~1-2 iterations. Default 15 handles ~10-15 fixes per session."
        },
        "entropy": {
          "type": "integer",
          "default": 10,
          "minimum": 1,
          "maximum": 200,
          "description": "Max iterations for entropy/cleanup mode. Each code smell fix needs ~2-3 iterations. Default 10 handles ~3-5 cleanups per session."
        },
        "command": {
          "type": "integer",
          "default": 10,
          "minimum": 1,
          "maximum": 200,
          "description": "Max iterations for command loop mode. Runs a slash command repeatedly in fresh sessions. Default 10 runs the command 10 times."
        }
      }
    },
    "server": {
      "type": "object",
      "description": "Git server configuration",
      "properties": {
        "type": {
          "type": [
            "string",
            "null"
          ],
          "description": "Server type",
          "enum": [
            "github",
            "gitlab",
            "bitbucket",
            null
          ]
        },
        "owner": {
          "type": [
            "string",
            "null"
          ],
          "description": "Repository owner/organization"
        },
        "repo": {
          "type": [
            "string",
            "null"
          ],
          "description": "Repository name"
        },
        "mcp": {
          "type": [
            "string",
            "null"
          ],
          "description": "MCP server name if configured (e.g., 'github' for GitHub MCP)"
        }
      }
    },
    "codebase": {
      "type": "object",
      "description": "Discovered codebase patterns and architecture",
      "properties": {
        "patterns": {
          "type": "array",
          "items": {
            "type": "string"
          },
          "description": "Discovered patterns (e.g., 'React', 'monorepo', 'microservices')"
        },
        "architecture": {
          "type": [
            "string",
            "null"
          ],
          "description": "Brief description of project architecture"
        },
        "dependencies": {
          "type": "array",
          "items": {
            "type": "string"
          },
          "description": "Key architectural dependencies"
        }
      }
    },
    "baseline": {
      "type": "object",
      "description": "Pre-existing failures to ignore during autopilot runs. Capture these at session start to avoid blocking on issues unrelated to current work.",
      "properties": {
        "typecheck": {
          "type": "object",
          "properties": {
            "errorCount": {
              "type": "integer",
              "description": "Number of pre-existing typecheck errors to tolerate"
            },
            "patterns": {
              "type": "array",
              "items": {
                "type": "string"
              },
              "description": "Error message patterns to ignore (regex)"
            }
          }
        },
        "tests": {
          "type": "object",
          "properties": {
            "failingTests": {
              "type": "array",
              "items": {
                "type": "string"
              },
              "description": "Names or patterns of known-failing tests to skip"
            }
          }
        },
        "lint": {
          "type": "object",
          "properties": {
            "errorCount": {
              "type": "integer",
              "description": "Number of pre-existing lint errors to tolerate"
            },
            "patterns": {
              "type": "array",
              "items": {
                "type": "string"
              },
              "description": "Error message patterns to ignore (regex)"
            }
          }
        }
      }
    },
    "coverage": {
      "type": "object",
      "description": "Test coverage mode targeting options",
      "properties": {
        "exclude": {
          "type": "array",
          "items": {
            "type": "string"
          },
          "description": "Glob patterns for files to exclude from coverage targeting (e.g., generated/*, vendor/*)"
        },
        "prioritize": {
          "type": "array",
          "items": {
            "type": "string"
          },
          "description": "Glob patterns for critical paths to prioritize (e.g., src/auth/*, src/payments/*)"
        },
        "recentDays": {
          "type": "integer",
          "default": 30,
          "description": "Number of days to consider for 'recently changed' prioritization"
        }
      }
    },
    "documentation": {
      "type": "object",
      "description": "Auto-documentation settings for updating docs after completing requirements",
      "properties": {
        "enabled": {
          "type": "boolean",
          "default": false,
          "description": "Whether to auto-update documentation"
        },
        "changelog": {
          "type": "object",
          "properties": {
            "file": {
              "type": [
                "string",
                "null"
              ],
              "default": "CHANGELOG.md",
              "description": "Path to changelog file"
            },
            "format": {
              "type": "string",
              "enum": [
                "keepachangelog",
                "conventional"
              ],
              "default": "keepachangelog",
              "description": "Changelog format style"
            }
          }
        },
        "readme": {
          "type": "object",
          "properties": {
            "enabled": {
              "type": "boolean",
              "default": false,
              "description": "Whether to update README sections"
            },
            "sections": {
              "type": "array",
              "items": {
                "type": "string"
              },
              "description": "README sections to update (e.g., features, usage)"
            }
          }
        }
      }
    },
    "metrics": {
      "type": "object",
      "description": "Metrics tracking configuration for analyzing autopilot effectiveness",
      "properties": {
        "enabled": {
          "type": "boolean",
          "default": false,
          "description": "Whether to collect metrics across sessions"
        },
        "file": {
          "type": [
            "string",
            "null"
          ],
          "default": "docs/autopilot/autopilot-metrics.json",
          "description": "File path for storing metrics data"
        }
      }
    },
    "analytics": {
      "type": "object",
      "description": "Session analytics for identifying token waste and improvement opportunities",
      "properties": {
        "enabled": {
          "type": "boolean",
          "default": true,
          "description": "Whether to generate per-session analytics files"
        },
        "directory": {
          "type": "string",
          "default": "docs/autopilot/analytics",
          "description": "Directory for storing session analytics files"
        },
        "thrashingThreshold": {
          "type": "integer",
          "default": 3,
          "minimum": 2,
          "maximum": 10,
          "description": "Number of consecutive identical errors before marking task as stuck (thrashing detection)"
        },
        "trackToolCalls": {
          "type": "boolean",
          "default": true,
          "description": "Whether to track tool call counts per requirement"
        },
        "trackFileAccess": {
          "type": "boolean",
          "default": true,
          "description": "Whether to track files read/written per requirement"
        }
      }
    },
    "workspaces": {
      "type": "object",
      "description": "Monorepo workspace configuration for projects with multiple packages",
      "properties": {
        "enabled": {
          "type": "boolean",
          "default": false,
          "description": "Whether this is a monorepo with workspaces"
        },
        "packages": {
          "type": "object",
          "description": "Map of package names to their configuration",
          "additionalProperties": {
            "type": "object",
            "properties": {
              "path": {
                "type": "string",
                "description": "Relative path to the package from repo root"
              },
              "feedbackLoops": {
                "type": "object",
                "description": "Package-specific feedback loop commands (overrides root)",
                "properties": {
                  "typecheck": {
                    "type": "object",
                    "properties": {
                      "command": {
                        "type": [
                          "string",
                          "null"
                        ]
                      },
                      "enabled": {
                        "type": "boolean",
                        "default": true
                      },
                      "sandbox": {
                        "type": "boolean",
                        "default": true
                      }
                    }
                  },
                  "tests": {
                    "type": "object",
                    "properties": {
                      "command": {
                        "type": [
                          "string",
                          "null"
                        ]
                      },
                      "enabled": {
                        "type": "boolean",
                        "default": true
                      },
                      "sandbox": {
                        "type": "boolean",
                        "default": true
                      }
                    }
                  },
                  "lint": {
                    "type": "object",
                    "properties": {
                      "command": {
                        "type": [
                          "string",
                          "null"
                        ]
                      },
                      "enabled": {
                        "type": "boolean",
                        "default": true
                      },
                      "sandbox": {
                        "type": "boolean",
                        "default": true
                      }
                    }
                  }
                }
              }
            }
          }
        }
      }
    },
    "issueTracker": {
      "type": "object",
      "description": "Issue tracker integration settings for linking work to GitHub Issues or other trackers",
      "properties": {
        "type": {
          "type": [
            "string",
            "null"
          ],
          "description": "Issue tracker type",
          "enum": [
            "github",
            "gitlab",
            "linear",
            "jira",
            null
          ]
        },
        "linkCommits": {
          "type": "boolean",
          "default": false,
          "description": "Append issue references to commit messages"
        },
        "updateOnComplete": {
          "type": "boolean",
          "default": false,
          "description": "Comment on issues and update labels when requirements complete"
        },
        "labelOnStart": {
          "type": [
            "string",
            "null"
          ],
          "description": "Label to apply when starting work on a requirement (e.g., 'in-progress')"
        },
        "labelOnComplete": {
          "type": [
            "string",
            "null"
          ],
          "description": "Label to apply when requirement passes (e.g., 'done')"
        }
      }
    },
    "notifications": {
      "type": "object",
      "description": "Notification settings for when autopilot completes",
      "properties": {
        "enabled": {
          "type": "boolean",
          "default": false,
          "description": "Whether to send notifications on completion"
        },
        "command": {
          "type": [
            "string",
            "null"
          ],
          "description": "Shell command to run on completion. Receives JSON with results via stdin. E.g., 'notify-send \"Autopilot\" \"$1\"' or 'say \"Autopilot complete\"'"
        },
        "webhook": {
          "type": [
            "string",
            "null"
          ],
          "description": "Webhook URL to POST results to on completion"
        },
        "ntfy": {
          "type": "object",
          "description": "ntfy.sh notification settings",
          "properties": {
            "topic": {
              "type": [
                "string",
                "null"
              ],
              "description": "ntfy topic name (e.g., 'my-autopilot-notifications')"
            },
            "server": {
              "type": "string",
              "default": "https://ntfy.sh",
              "description": "ntfy server URL"
            }
          }
        }
      }
    }
  }
}
